{
 "schema_version": 1,
 "notes": "One table per enc.<map_id> ref in data/maps/maps.json. Weights sum to 100 per table (rarity buckets per systems-spec §1.8). kind: oscura 1/8 per step, matorral 1/10, anden 1/12, sendero 1/10, azotea 1/10, tableau 1/8, safari (zoo rules §1.5). fishing: anzuelo viejo/bueno/super sub-tables. w:0 = rumor-only listing (dex habitat hint), never rolled.",
 "tables": {
  "enc.tn_propatria__canoamarillo": {
   "kind": "oscura",
   "slots": [
    {
     "id": "ratica",
     "w": 35,
     "min": 3,
     "max": 5
    },
    {
     "id": "palomita",
     "w": 25,
     "min": 3,
     "max": 5
    },
    {
     "id": "sustico",
     "w": 20,
     "min": 3,
     "max": 5
    },
    {
     "id": "bachaquito",
     "w": 10,
     "min": 3,
     "max": 5
    },
    {
     "id": "gatonegro",
     "w": 5,
     "min": 4,
     "max": 5
    },
    {
     "id": "cocuyin",
     "w": 4,
     "min": 4,
     "max": 5
    },
    {
     "id": "fichita",
     "w": 1,
     "min": 5,
     "max": 5
    }
   ],
   "notes": "Paradas menores: Pérez Bonalde, Plaza Sucre, Gato Negro, Agua Salud. Gato Negro mans its own stop."
  },
  "enc.tn_canoamarillo__capitolio": {
   "kind": "oscura",
   "slots": [
    {
     "id": "ratica",
     "w": 30,
     "min": 4,
     "max": 7
    },
    {
     "id": "sustico",
     "w": 25,
     "min": 4,
     "max": 7
    },
    {
     "id": "duendecito",
     "w": 20,
     "min": 4,
     "max": 7
    },
    {
     "id": "mapanarita",
     "w": 10,
     "min": 5,
     "max": 7
    },
    {
     "id": "rabipelado",
     "w": 9,
     "min": 5,
     "max": 7
    },
    {
     "id": "velita",
     "w": 5,
     "min": 5,
     "max": 7
    },
    {
     "id": "fichita",
     "w": 1,
     "min": 6,
     "max": 7
    }
   ]
  },
  "enc.tn_capitolio__bellasartes": {
   "kind": "oscura",
   "slots": [
    {
     "id": "sustico",
     "w": 30,
     "min": 6,
     "max": 9
    },
    {
     "id": "ratica",
     "w": 25,
     "min": 6,
     "max": 9
    },
    {
     "id": "velita",
     "w": 20,
     "min": 6,
     "max": 9
    },
    {
     "id": "zamurito",
     "w": 10,
     "min": 7,
     "max": 9
    },
    {
     "id": "pavoso",
     "w": 9,
     "min": 7,
     "max": 9
    },
    {
     "id": "bombillito",
     "w": 5,
     "min": 7,
     "max": 9
    },
    {
     "id": "telefonito",
     "w": 1,
     "min": 9,
     "max": 9
    }
   ],
   "notes": "Paradas menores: La Hoyada, Parque Carabobo."
  },
  "enc.tn_bellasartes__plazavenezuela": {
   "kind": "oscura",
   "slots": [
    {
     "id": "sustico",
     "w": 30,
     "min": 8,
     "max": 11
    },
    {
     "id": "velita",
     "w": 25,
     "min": 8,
     "max": 11
    },
    {
     "id": "bombillito",
     "w": 20,
     "min": 8,
     "max": 11
    },
    {
     "id": "ratica",
     "w": 10,
     "min": 8,
     "max": 11
    },
    {
     "id": "pavoso",
     "w": 9,
     "min": 9,
     "max": 11
    },
    {
     "id": "fuentecita",
     "w": 5,
     "min": 10,
     "max": 11
    },
    {
     "id": "cafecito",
     "w": 1,
     "min": 10,
     "max": 11
    }
   ]
  },
  "enc.tn_plazavenezuela__sabanagrande": {
   "kind": "oscura",
   "slots": [
    {
     "id": "palomita",
     "w": 30,
     "min": 10,
     "max": 13
    },
    {
     "id": "sustico",
     "w": 25,
     "min": 10,
     "max": 13
    },
    {
     "id": "maraquita",
     "w": 20,
     "min": 10,
     "max": 13
    },
    {
     "id": "periquito",
     "w": 10,
     "min": 10,
     "max": 13
    },
    {
     "id": "fuentecita",
     "w": 9,
     "min": 11,
     "max": 13
    },
    {
     "id": "cafecito",
     "w": 5,
     "min": 11,
     "max": 13
    },
    {
     "id": "cuatrico",
     "w": 1,
     "min": 12,
     "max": 13
    }
   ]
  },
  "enc.tn_sabanagrande__chacaito": {
   "kind": "oscura",
   "slots": [
    {
     "id": "periquito",
     "w": 30,
     "min": 12,
     "max": 15
    },
    {
     "id": "cachorro",
     "w": 25,
     "min": 12,
     "max": 15
    },
    {
     "id": "sustico",
     "w": 20,
     "min": 12,
     "max": 15
    },
    {
     "id": "maraquita",
     "w": 10,
     "min": 12,
     "max": 15
    },
    {
     "id": "tequenito",
     "w": 9,
     "min": 13,
     "max": 15
    },
    {
     "id": "gatonegro",
     "w": 5,
     "min": 13,
     "max": 15
    },
    {
     "id": "paraulata",
     "w": 1,
     "min": 14,
     "max": 15
    }
   ]
  },
  "enc.tn_chacaito__altamira": {
   "kind": "oscura",
   "slots": [
    {
     "id": "cachorro",
     "w": 30,
     "min": 14,
     "max": 17
    },
    {
     "id": "zamurito",
     "w": 25,
     "min": 14,
     "max": 17
    },
    {
     "id": "sustico",
     "w": 20,
     "min": 14,
     "max": 17
    },
    {
     "id": "velita",
     "w": 10,
     "min": 14,
     "max": 17
    },
    {
     "id": "tucusito",
     "w": 9,
     "min": 15,
     "max": 17
    },
    {
     "id": "duendecito",
     "w": 5,
     "min": 15,
     "max": 17
    },
    {
     "id": "elsereno",
     "w": 1,
     "min": 16,
     "max": 17
    }
   ],
   "notes": "Parada menor: Chacao."
  },
  "enc.tn_altamira__petare": {
   "kind": "oscura",
   "slots": [
    {
     "id": "zamurito",
     "w": 30,
     "min": 16,
     "max": 19
    },
    {
     "id": "cachicamo",
     "w": 25,
     "min": 16,
     "max": 19
    },
    {
     "id": "sustico",
     "w": 20,
     "min": 16,
     "max": 19
    },
    {
     "id": "manguito",
     "w": 10,
     "min": 16,
     "max": 19
    },
    {
     "id": "duendecito",
     "w": 9,
     "min": 17,
     "max": 19
    },
    {
     "id": "mapanarita",
     "w": 5,
     "min": 17,
     "max": 19
    },
    {
     "id": "fichita",
     "w": 1,
     "min": 18,
     "max": 19
    }
   ],
   "notes": "Paradas menores: Miranda, Los Dos Caminos, Los Cortijos, La California."
  },
  "enc.tn_petare__paloverde": {
   "kind": "oscura",
   "slots": [
    {
     "id": "cachicamo",
     "w": 30,
     "min": 18,
     "max": 22
    },
    {
     "id": "manguito",
     "w": 25,
     "min": 18,
     "max": 22
    },
    {
     "id": "zamurito",
     "w": 20,
     "min": 18,
     "max": 22
    },
    {
     "id": "arepita",
     "w": 10,
     "min": 18,
     "max": 22
    },
    {
     "id": "burritosabanero",
     "w": 9,
     "min": 19,
     "max": 22
    },
    {
     "id": "ratonante",
     "w": 5,
     "min": 20,
     "max": 22
    },
    {
     "id": "elsereno",
     "w": 1,
     "min": 21,
     "max": 22
    }
   ],
   "notes": "Parada menor: Palo Verde vestibule (Mariche dock, post-game)."
  },
  "enc.sf_calvario": {
   "kind": "matorral",
   "slots": [
    {
     "id": "bejuquito",
     "w": 30,
     "min": 5,
     "max": 9
    },
    {
     "id": "mayita",
     "w": 25,
     "min": 5,
     "max": 9
    },
    {
     "id": "bachaquito",
     "w": 20,
     "min": 5,
     "max": 9
    },
    {
     "id": "mapanarita",
     "w": 10,
     "min": 6,
     "max": 9
    },
    {
     "id": "araguatico",
     "w": 9,
     "min": 6,
     "max": 9
    },
    {
     "id": "cunaguarin",
     "w": 5,
     "min": 7,
     "max": 9
    },
    {
     "id": "guacamayin",
     "w": 1,
     "min": 8,
     "max": 9
    }
   ],
   "notes": "Machete country (canon). El matapalo grown here is story-famous but battles only via evolution or Mariche."
  },
  "enc.sf_caobos": {
   "kind": "matorral",
   "slots": [
    {
     "id": "iguanin",
     "w": 30,
     "min": 8,
     "max": 12
    },
    {
     "id": "mayita",
     "w": 20,
     "min": 8,
     "max": 12
    },
    {
     "id": "tucusito",
     "w": 20,
     "min": 8,
     "max": 12
    },
    {
     "id": "palomita",
     "w": 15,
     "min": 8,
     "max": 12
    },
    {
     "id": "sapitolipa",
     "w": 9,
     "min": 9,
     "max": 12
    },
    {
     "id": "pereza",
     "w": 5,
     "min": 10,
     "max": 12
    },
    {
     "id": "cardenalito",
     "w": 1,
     "min": 11,
     "max": 12
    }
   ],
   "fishing": {
    "viejo": [
     {
      "id": "guabina",
      "w": 60,
      "min": 5,
      "max": 10
     },
     {
      "id": "caribito",
      "w": 40,
      "min": 5,
      "max": 10
     }
    ],
    "bueno": [
     {
      "id": "guabina",
      "w": 50,
      "min": 10,
      "max": 20
     },
     {
      "id": "caribito",
      "w": 30,
      "min": 10,
      "max": 20
     },
     {
      "id": "sapitolipa",
      "w": 20,
      "min": 10,
      "max": 20
     }
    ]
   },
   "notes": "Pereza's tree (canon). Pond allows fishing."
  },
  "enc.sf_bulevar": {
   "kind": "matorral",
   "slots": [
    {
     "id": "palomita",
     "w": 30,
     "min": 10,
     "max": 14
    },
    {
     "id": "periquito",
     "w": 25,
     "min": 10,
     "max": 14
    },
    {
     "id": "maraquita",
     "w": 20,
     "min": 10,
     "max": 14
    },
    {
     "id": "cachorro",
     "w": 10,
     "min": 10,
     "max": 14
    },
    {
     "id": "paraulata",
     "w": 9,
     "min": 11,
     "max": 14
    },
    {
     "id": "tequenito",
     "w": 5,
     "min": 11,
     "max": 14
    },
    {
     "id": "cardenalito",
     "w": 1,
     "min": 13,
     "max": 14
    }
   ],
   "notes": "Chess players, buskers; first Bachaqueros sighting (story)."
  },
  "enc.sf_puertaavila": {
   "kind": "sendero",
   "slots": [
    {
     "id": "araguanecito",
     "w": 30,
     "min": 12,
     "max": 16
    },
    {
     "id": "bejuquito",
     "w": 25,
     "min": 12,
     "max": 16
    },
    {
     "id": "cunaguarin",
     "w": 20,
     "min": 12,
     "max": 16
    },
    {
     "id": "tucusito",
     "w": 10,
     "min": 12,
     "max": 16
    },
    {
     "id": "lajita",
     "w": 9,
     "min": 13,
     "max": 16
    },
    {
     "id": "zamurito",
     "w": 5,
     "min": 13,
     "max": 16
    },
    {
     "id": "ucumari",
     "w": 1,
     "min": 16,
     "max": 16
    }
   ],
   "notes": "Act 1 Ávila teaser. Ucumarí sighting is the trailhead rumor."
  },
  "enc.sf_parquedeleste": {
   "kind": "matorral",
   "slots": [
    {
     "id": "iguanin",